taurus,"taurus, a bull, bullock, steer",6,"taurus,","taurus,","a bull, bullock, steer","<gloss>a bull, bullock, steer</gloss>"
tegimen,"tegimen, a covering, cover",7,"tegimen,","tegimen,","a covering, cover","<gloss>a covering, cover</gloss>"
tempus,"tempus, time, period, season, interval; (pl.) temples, face",6,"tempus,","tempus,","time, period, season, interval; (pl.) temples, face","<gloss>time, period, season, interval; (pl.) temples, face</gloss>"
teneo,"teneo, to hold, keep, have, grasp, hold fast",5,"teneo,","teneo,","to hold, keep, have, grasp, hold fast","<gloss>to hold, keep, have, grasp, hold fast</gloss>"
tener,"tener, soft, delicate, tender, yielding",5,"tener,","tener,","soft, delicate, tender, yielding","<gloss>soft, delicate, tender, yielding</gloss>"
tento,"tento, to handle, touch, feel; try",5,"tento,","tento,","to handle, touch, feel; try","<gloss>to handle, touch, feel; try</gloss>"
tenuis,"tenuis, drawn out, meagre, slim, thin, lank, slender",6,"tenuis,","tenuis,","drawn out, meagre, slim, thin, lank, slender","<gloss>drawn out, meagre, slim, thin, lank, slender</gloss>"
Tigris,the Tigris (river in Mesopotamia),6,the Tig,"Tigris,",the Tigris (river in Mesopotamia),<gloss>the Tigris (river in Mesopotamia)</gloss>
Tityrus,"Tityrus, a shepherd",7,"Tityrus,","Tityrus,",a shepherd,<gloss>a shepherd</gloss>
tondeo,"tondeo, to shear, clip, crop, shave",6,"tondeo,","tondeo,","to shear, clip, crop, shave","<gloss>to shear, clip, crop, shave</gloss>"
totus,"totus, all, all the, all at once, the whole, entire, total",5,"totus,","totus,","all, all the, all at once, the whole, entire, total","<gloss>all, all the, all at once, the whole, entire, total</gloss>"
tu,"tu, you",2,"tu,","tu,",you,<gloss>you</gloss>
tugurium,"tugurium, a hut, cot, cottage",8,"tugurium,","tugurium,","a hut, cot, cottage","<gloss>a hut, cot, cottage</gloss>"
turbo,"turbo, to make an uproar, move confusedly, be in disorder",5,"turbo,","turbo,","to make an uproar, move confusedly, be in disorder","<gloss>to make an uproar, move confusedly, be in disorder</gloss>"
turtur,"turtur, a turtle-dove",6,"turtur,","turtur,",a turtle-dove,<gloss>a turtle-dove</gloss>
tuus,"tuus, thy, thine, your, yours",4,"tuus,","tuus,","thy, thine, your, yours","<gloss>thy, thine, your, yours</gloss>"
uenio,"venio, to come",5,"venio,","uenio,","venio, to come","<gloss>venio, to come</gloss>"
uerum,"verum2, the truth",5,verum2,"uerum,","verum2, the truth","<gloss>verum2, the truth</gloss>"
uiburnum,"viburnum, the wayfaring-tree",8,"viburnum,","uiburnum,","viburnum, the wayfaring-tree","<gloss>viburnum, the wayfaring-tree</gloss>"
uicinus,"vicinus, of the neighborhood, near, neighboring; (noun) a neighbor",7,"vicinus,","uicinus,","vicinus, of the neighborhood, near, neighboring; (noun) a neighbor","<gloss>vicinus, of the neighborhood, near, neighboring; (noun) a neighbor</gloss>"
uictima,"victima, a beast for sacrifice, sacrifice, victim",7,"victima,","uictima,","victima, a beast for sacrifice, sacrifice, victim","<gloss>victima, a beast for sacrifice, sacrifice, victim</gloss>"
uideo,"video, to see, discern, perceive",5,"video,","uideo,","video, to see, discern, perceive","<gloss>video, to see, discern, perceive</gloss>"
uilla,"villa, a country-house, country-seat, farm, villa",5,"villa,","uilla,","villa, a country-house, country-seat, farm, villa","<gloss>villa, a country-house, country-seat, farm, villa</gloss>"
uiridis,"viridis, green",7,"viridis,","uiridis,","viridis, green","<gloss>viridis, green</gloss>"
uitis,"vitis, a vine, grape-vine",5,"vitis,","uitis,","vitis, a vine, grape-vine","<gloss>vitis, a vine, grape-vine</gloss>"
uix,"vix, with difficulty, with much ado, hardly, scarcely, barely",3,"vix,","uix,","vix, with difficulty, with much ado, hardly, scarcely, barely","<gloss>vix, with difficulty, with much ado, hardly, scarcely, barely</gloss>"
ulmus,"ulmus, an elm, elm-tree",5,"ulmus,","ulmus,","an elm, elm-tree","<gloss>an elm, elm-tree</gloss>"
umbra,"umbra, a shade, shadow",5,"umbra,","umbra,","a shade, shadow","<gloss>a shade, shadow</gloss>"
umquam,"umquam, at any time, ever",6,"umquam,","umquam,","at any time, ever","<gloss>at any time, ever</gloss>"
undique,"undique, from all parts, from every quarter, on all sides, all around, on every part, everywhere",7,"undique,","undique,","from all parts, from every quarter, on all sides, all around, on every part, everywhere","<gloss>from all parts, from every quarter, on all sides, all around, on every part, everywhere</gloss>"
uoco,"voco, to call, summon, invoke, call together, convoke",4,"voco,","uoco,","voco, to call, summon, invoke, call together, convoke","<gloss>voco, to call, summon, invoke, call together, convoke</gloss>"
uolo,"volo, to will, wish, want, purpose, be minded, determine",4,"volo,","uolo,","volo, to will, wish, want, purpose, be minded, determine","<gloss>volo, to will, wish, want, purpose, be minded, determine</gloss>"
uos,you (plural),3,you ,"uos,",you (plural),<gloss>you (plural)</gloss>
urbs,"urbs, a walled town, city",4,"urbs,","urbs,","a walled town, city","<gloss>a walled town, city</gloss>"
usque,"usque, all the way, right on, without interruption, continuously, even",5,"usque,","usque,","all the way, right on, without interruption, continuously, even","<gloss>all the way, right on, without interruption, continuously, even</gloss>"
ut,"ut, in order that, so that, when; as; how",2,"ut,","ut,","in order that, so that, when; as; how","<gloss>in order that, so that, when; as; how</gloss>"
uultus,"vultus, facial expression, face",6,"vultus,","uultus,","vultus, facial expression, face","<gloss>vultus, facial expression, face</gloss>"
